{"type":"config","name":"s3dashmap throughput optimization","metricName":"ops_sec","metricUnit":"","bestDirection":"higher"}
{"run":1,"commit":"16c0d1a","metric":25431838,"metrics":{"hit_pct":84.9,"p50_us":0.12,"p99_us":1.62,"cv_pct":17.4,"eff_ops_sec":21584873,"tail_us":1.5},"status":"keep","description":"Baseline: unmodified s3dashmap. 25.4M ops/sec, 84.9% hit rate, CV 17.4% (noisy)","timestamp":1774642473679,"segment":0,"confidence":null,"iterationTokens":1222,"asi":{"hypothesis":"baseline measurement","note":"CV=17.4% is noisy — need large improvements to be confident. ~25-28M ops/sec range across runs. 12 cores = 48 shards (default), shard_cap=625 per shard for 30K items."}}
{"run":2,"commit":"125cdf4","metric":27424915,"metrics":{"hit_pct":84.9,"p50_us":0.12,"p99_us":1.67,"cv_pct":3,"eff_ops_sec":23275794,"tail_us":1.54},"status":"keep","description":"Replace bump_freq CAS loop with simple load+store. +7.8% throughput, CV 3%","timestamp":1774642543100,"segment":0,"confidence":null,"iterationTokens":3112,"asi":{"hypothesis":"CAS loop in bump_freq (80% of ops) replaced with relaxed load+store. Races harmless since freq is a heuristic saturating at 3.","result":"+7.8% throughput, CV improved from 17% to 3%","insight":"fetch_update CAS loop was contended on hot entries under concurrent reads"}}
{"run":3,"commit":"0dd1914","metric":27565016,"metrics":{"hit_pct":84.9,"p50_us":0.12,"p99_us":1.46,"cv_pct":7.1,"eff_ops_sec":23395614,"tail_us":1.33},"status":"keep","description":"Ghost set stores hashes instead of full keys — eliminates key cloning. +0.5% throughput, p99 improved 1.67→1.46µs","timestamp":1774642672266,"segment":0,"confidence":15.226001241961157,"iterationTokens":13026,"asi":{"hypothesis":"Replace ghost HashSet<K> with HashSet<u64> to eliminate key cloning on eviction path","result":"marginal throughput gain but nice p99 improvement and code simplification","insight":"ghost set is only touched on write path eviction (~20% of ops), so savings are limited. The real win is less memory pressure from not cloning string keys."}}
{"run":4,"commit":"0dd1914","metric":27357146,"metrics":{"hit_pct":84.9,"p50_us":0.12,"p99_us":1.42,"cv_pct":9.6,"eff_ops_sec":23219063,"tail_us":1.29},"status":"discard","description":"Eliminate double map.find() in eviction + simplify freq decrement. No throughput gain (-0.75%)","timestamp":1774642741344,"segment":0,"confidence":20.524154519651706,"iterationTokens":5056,"asi":{"hypothesis":"Eliminate redundant map.find() in evict_from_small (was called twice for same key) and replace CAS freq decrement with simple store under write lock","rollback_reason":"primary metric within noise of previous best","next_action_hint":"eviction path optimizations have diminishing returns on 80/20 read workload. Focus on read path or structural changes (shard count, hash function)","insight":"double find was already fast due to CPU cache locality — second find hits warm cache line"}}
{"type":"config","name":"s3dashmap effective throughput + latency optimization","metricName":"eff_ops_sec","metricUnit":"","bestDirection":"higher"}
{"run":5,"commit":"f33f25e","metric":23123015,"metrics":{"ops_sec":27244626,"hit_pct":84.9,"p50_us":0.12,"p99_us":1.5,"cv_pct":7.2,"tail_us":1.38},"status":"keep","description":"New baseline for eff_ops_sec focus. 23.1M eff ops/s, p50=0.12µs, p99=1.50µs, tail=1.38µs","timestamp":1774642782665,"segment":1,"confidence":null,"iterationTokens":157,"asi":{"hypothesis":"baseline with bump_freq + ghost hash optimizations already applied","focus":"effective throughput (ops_sec * hit_rate), p50, p99, tail latency","note":"hit_rate=84.9% is stable; improving it would multiply into eff_ops_sec. p99=1.5µs, tail=1.38µs are the latency targets."}}
{"run":6,"commit":"0164357","metric":23275470,"metrics":{"ops_sec":27423969,"hit_pct":84.9,"p50_us":0.12,"p99_us":1.46,"cv_pct":8.3,"tail_us":1.33},"status":"keep","description":"Pre-allocate hash table + queues to shard capacity, inline hot path functions. p99: 1.50→1.46µs, tail: 1.38→1.33µs","timestamp":1774642906464,"segment":1,"confidence":null,"iterationTokens":537,"asi":{"hypothesis":"Pre-allocate map to shard_cap, VecDeques to 2x capacity, HashSet to ghost_cap. Add #[inline] to hash_u64, determine_shard, evict_one","result":"consistent p99 reduction 1.50→1.46µs and tail 1.38→1.33µs across 2 runs. eff_ops modest +0.7-3.5%","insight":"pre-allocation eliminates resize spikes that cause tail latency. Inline hints help LTO but marginal in release profile","confirmed_runs":2}}
{"run":7,"commit":"ff3f581","metric":23664884,"metrics":{"ops_sec":27882461,"hit_pct":84.9,"p50_us":0.12,"p99_us":1.46,"cv_pct":7.5,"tail_us":1.33},"status":"keep","description":"Eliminate double map.find() in eviction, replace CAS with store under write lock. +1.7% eff_ops, p99/tail maintained","timestamp":1774642966160,"segment":1,"confidence":3.554288150601817,"iterationTokens":4655,"asi":{"hypothesis":"Single find() per eviction candidate instead of two; replace fetch_update CAS with simple store for freq decrement (safe under exclusive write lock)","result":"+1.7% eff_ops. p99=1.46 and tail=1.33 unchanged from pre-alloc improvement","insight":"eviction path improvements compound: pre-alloc removed resize spikes, single-find reduces per-eviction cost"}}
{"run":8,"commit":"44ced72","metric":23769404,"metrics":{"ops_sec":28006263,"hit_pct":84.9,"p50_us":0.12,"p99_us":1.38,"cv_pct":1,"tail_us":1.25},"status":"keep","description":"Direct _insert bypasses Entry API: fast update-in-place for occupied, inline eviction for vacant. p99: 1.46→1.38µs, tail: 1.33→1.25µs, CV: 1.0%","timestamp":1774643120547,"segment":1,"confidence":2.617309195155628,"iterationTokens":9846,"asi":{"hypothesis":"Direct _insert without Entry enum dispatch. Occupied path: single find_or_find_insert_slot + in-place value swap. Vacant path: inline ghost check + eviction + insert.","result":"p99 1.46→1.38µs, tail 1.33→1.25µs, CV dropped to 1.0%. eff_ops +0.4%","insight":"eliminating Entry enum construction + match dispatch reduces instructions on write path. The consistency improvement (CV 1.0%) suggests less variance in write latency","key_win":"p99 and tail latency significantly reduced"}}
{"run":9,"commit":"44ced72","metric":21358338,"metrics":{"ops_sec":25165309,"hit_pct":84.9,"p50_us":0.12,"p99_us":1.79,"cv_pct":2.4,"tail_us":1.67},"status":"discard","description":"Reduce shard multiplier 4x→2x (64→32 shards). REGRESSION: -10% eff_ops, p99: 1.38→1.79µs","timestamp":1774643200533,"segment":1,"confidence":1.6599018011679088,"iterationTokens":4489,"asi":{"hypothesis":"Fewer shards (32 vs 64) = larger per-shard tables, less overhead, but more lock contention","rollback_reason":"significant regression in all metrics. 32 shards on 12 cores creates too much contention","next_action_hint":"64 shards is correct for 12 cores. Try MORE shards or different structural changes. Do NOT reduce shard count.","insight":"shard_count=4*ncpu is well-tuned. contention dominates at 2*ncpu for this workload."}}
{"run":10,"commit":"44ced72","metric":23777739,"metrics":{"ops_sec":28016207,"hit_pct":84.9,"p50_us":0.12,"p99_us":1.5,"cv_pct":11.7,"tail_us":1.38},"status":"discard","description":"Add #[inline] to _get, _yield_read_shard, _yield_write_shard. No consistent improvement — LTO already inlines","timestamp":1774643276316,"segment":1,"confidence":2.130523130775278,"iterationTokens":1014,"asi":{"hypothesis":"#[inline] on hot path trait methods to help compiler","rollback_reason":"no consistent improvement. first run showed good p99 but second run reverted. LTO in release profile already inlines monomorphized trait methods","next_action_hint":"inline hints are useless with LTO. focus on algorithmic/structural changes: reduce key cloning, improve eviction cache-friendliness, or reduce lock hold time"}}
{"run":11,"commit":"75b00fe","metric":24025628,"metrics":{"ops_sec":28308625,"hit_pct":84.9,"p50_us":0.12,"p99_us":1.38,"cv_pct":2.8,"tail_us":1.25},"status":"keep","description":"Switch ghost_set from std HashSet (SipHash) to hashbrown::HashSet (ahash). +1-2% eff_ops, p99=1.38µs maintained, CV=2.8%","timestamp":1774643389156,"segment":1,"confidence":2.5020873528042045,"iterationTokens":522,"asi":{"hypothesis":"Replace std HashSet<u64> (SipHash) with hashbrown::HashSet<u64, ahash::RandomState> for ghost_set. ahash is faster for u64 keys.","result":"consistent +1-2% eff_ops (24.0-24.3M), p99=1.38µs, CV=2.8%","insight":"SipHash overhead on ghost_set was measurable even though ghost set is only accessed on write path. hashbrown::HashSet also has better probe performance than std.","confirmed_runs":2}}
{"run":12,"commit":"75b00fe","metric":24138244,"metrics":{"ops_sec":28439669,"hit_pct":84.9,"p50_us":0.12,"p99_us":1.42,"cv_pct":10.3,"tail_us":1.29},"status":"discard","description":"Hash-only eviction queues (VecDeque<u64> + hash in CacheEntry). +0.5% eff_ops but p99 regressed 1.38→1.42-1.46µs","timestamp":1774643675579,"segment":1,"confidence":2.474322353560385,"iterationTokens":1012,"asi":{"hypothesis":"Replace VecDeque<(u64, K)> with VecDeque<u64> to eliminate key cloning. Store hash in CacheEntry for correct eviction lookup.","rollback_reason":"p99 regressed 1.38→1.42-1.46µs. The 8-byte hash field in CacheEntry increased per-entry size (16→24 bytes for V=Arc<String>), worsening read-path cache behavior.","next_action_hint":"hash-only queues need CacheEntry to stay small. Try: pack hash into existing padding, use compact hash (u32), or keep key queues but avoid String clone via Rc<str>","insight":"CacheEntry size matters for read latency. Each extra byte per entry = more cache misses on the 80% read path."}}
{"run":13,"commit":"123d58f","metric":24113557,"metrics":{"ops_sec":28411882,"hit_pct":84.9,"p50_us":0.12,"p99_us":1.25,"cv_pct":2.5,"tail_us":1.12},"status":"keep","description":"Identity hasher for ghost_set (zero-cost hash for u64). p99: 1.38→1.25µs, tail: 1.25→1.12µs, eff_ops +0.4%","timestamp":1774643830465,"segment":1,"confidence":2.87820242740874,"iterationTokens":518,"asi":{"hypothesis":"Replace ahash in ghost_set with identity hasher. Ghost set u64 values are already ahash outputs — re-hashing wastes cycles.","result":"p99 1.38→1.25µs (-9.4%), tail 1.25→1.12µs (-10.4%). eff_ops stable at 24.1M","insight":"ghost_set hash overhead was measurable on write path tail latency. Identity hasher eliminates ~5ns per ghost_set operation (insert/remove/contains).","confirmed_runs":2,"key_win":"both p99 and tail latency new bests"}}
{"run":14,"commit":"3978acd","metric":24958239,"metrics":{"ops_sec":29407140,"hit_pct":84.9,"p50_us":0.12,"p99_us":1.08,"cv_pct":13,"tail_us":0.96},"status":"keep","description":"Increase shard count 64→128 (8x ncpu). eff_ops: 24.1→25.0M (+3.5%), p99: 1.25→1.08µs (-13.6%), tail sub-µs at 0.96µs!","timestamp":1774643935636,"segment":1,"confidence":5.208836059478498,"iterationTokens":534,"asi":{"hypothesis":"More shards (128 vs 64) = less contention with 12 threads. shard_cap=235 per shard.","result":"massive improvement: eff_ops +3.5%, p99 1.25→1.08µs, tail breaks sub-µs at 0.96µs!","insight":"64 shards had measurable contention. 128 shards = 12 threads / 128 shards = 9.4% chance of shard collision. The reduced contention is worth the smaller per-shard tables.","confirmed_runs":2,"key_win":"sub-microsecond tail latency achieved"}}
{"run":15,"commit":"3978acd","metric":24627189,"metrics":{"ops_sec":29005410,"hit_pct":84.9,"p50_us":0.12,"p99_us":1.08,"cv_pct":8.6,"tail_us":0.96},"status":"discard","description":"Double ghost_cap (2× shard_cap). No hit rate improvement (still 84.9%), eff_ops -1.3%","timestamp":1774644029238,"segment":1,"confidence":5.090703318955354,"iterationTokens":8476,"asi":{"hypothesis":"Larger ghost set (2× shard_cap) should catch more evicted key re-insertions, routing them to main for better retention","rollback_reason":"hit rate unchanged. Zipfian s=1.07 with 30K/480K is near theoretical S3-FIFO optimum (~84.9%). Ghost set at 1× already sufficient.","next_action_hint":"hit rate is hard to improve without algorithm changes. Try: smaller small_cap (5% vs 10%), or focus on throughput/latency/variance","insight":"ghost set size doesn't matter for this workload — the Zipfian skew means most re-insertions happen within 1× capacity window"}}
{"run":16,"commit":"3978acd","metric":23058850,"metrics":{"ops_sec":27142832,"hit_pct":85,"p50_us":0.12,"p99_us":0.67,"cv_pct":10.5,"tail_us":0.54},"status":"discard","description":"Shrink small queue 10%→5%. Hit rate 84.9→85.0% but huge variance (CV 10.5%), eff_ops unstable","timestamp":1774644093259,"segment":1,"confidence":4.254240392037776,"iterationTokens":922,"asi":{"hypothesis":"Smaller small queue (5% vs 10%) gives more main slots for hot entries, improving hit rate","rollback_reason":"variance too high — eff_ops swung 23-25M across 2 runs, CV 10.5%. User requires robustness.","next_action_hint":"5% small is too aggressive. Try 7-8% or adjust MAX_FREQ instead. Hit rate confirmed improvable by tuning small/main ratio.","insight":"hit rate 85.0% confirmed across 2 runs (vs 84.9% baseline). Small 5% catches promotions faster but makes eviction pattern more sensitive to op ordering."}}
{"run":17,"commit":"3978acd","metric":24741274,"metrics":{"ops_sec":29131770,"hit_pct":84.9,"p50_us":0.12,"p99_us":1.12,"cv_pct":6.5,"tail_us":1},"status":"discard","description":"Shrink small queue 10%→7%. Hit rate unchanged, no clear improvement on any target","timestamp":1774644150806,"segment":1,"confidence":3.653866752676355,"iterationTokens":636,"asi":{"hypothesis":"7% small / 93% main might improve hit rate while being more stable than 5%","rollback_reason":"hit rate unchanged at 84.9%, eff_ops and latency similar to previous keep, no improvement on any target","next_action_hint":"small/main ratio tuning at 7-10% doesn't affect this Zipfian workload. The 5% did get 85.0% but with bad variance. Focus on throughput/latency instead.","insight":"at shard_cap=235, small_cap changes from 24 to 17 entries — too small a difference to affect eviction quality"}}
{"run":18,"commit":"3978acd","metric":25097020,"metrics":{"ops_sec":29570319,"hit_pct":84.9,"p50_us":0.12,"p99_us":1,"cv_pct":11.6,"tail_us":0.88},"status":"discard","description":"256 shards (16×ncpu). Best latency ever (p99=0.96-1.00µs) but CV consistently 10-12% — too variable","timestamp":1774644253767,"segment":1,"confidence":2.7153927702429277,"iterationTokens":671,"asi":{"hypothesis":"256 shards (16×ncpu) reduces contention further. shard_cap=118.","rollback_reason":"CV consistently 10-12% across 2 runs. User requires robustness. 256 shards with 118 entries/shard makes per-iteration performance sensitive to hash distribution.","next_action_hint":"128 shards (8×ncpu) is the sweet spot for this workload. Diminishing returns on shard count. Focus on other dimensions.","insight":"shard count vs robustness tradeoff: more shards = better latency but smaller per-shard tables = more variance. 128 is the balance point."}}
{"run":19,"commit":"3978acd","metric":24894361,"metrics":{"ops_sec":29331965,"hit_pct":84.9,"p50_us":0.12,"p99_us":1.08,"cv_pct":10.9,"tail_us":0.96},"status":"discard","description":"Pre-clone key before write lock to reduce lock hold time. Marginal — wasted clone for 85% occupied writes offsets benefit","timestamp":1774644528449,"segment":1,"confidence":2.564429899699013,"iterationTokens":793,"asi":{"hypothesis":"Pre-clone key before write lock moves allocation out of critical section","rollback_reason":"no consistent improvement across 2 runs. 85% of writes are occupied (clone wasted), only 3% of total ops benefit from faster lock hold time.","next_action_hint":"key cloning is not the bottleneck. Only 3% of ops do vacant inserts. Focus on read path (80% of ops) or reduce variance.","insight":"speculative pre-clone hurts more than it helps — extra alloc+dealloc overhead on 17% of ops (occupied writes) is measurable"}}
{"run":20,"commit":"496e32e","metric":24657617,"metrics":{"ops_sec":29053205,"hit_pct":84.9,"p50_us":0.12,"p99_us":1.25,"cv_pct":3.4,"tail_us":1.12},"status":"keep","description":"3-run median benchmark for stability. Baseline: eff_ops=24.7M, p99=1.25µs, tail=1.12µs, CV=3.4%","timestamp":1774644619635,"segment":1,"confidence":2.913733839483181,"iterationTokens":4289,"asi":{"hypothesis":"3-run median benchmark reduces measurement noise. Same code as before.","result":"stable measurement: 24.66M median of [25.0M, 24.0M, 24.66M]. Previous single-run results ranged 24-25M.","insight":"single benchmark runs have ~5-10% noise. 3-run median gives a reliable signal for comparing changes."}}
{"run":21,"commit":"fd0f37b","metric":24621225,"metrics":{"ops_sec":28913056,"hit_pct":85.2,"p50_us":0.12,"p99_us":1.12,"cv_pct":12.6,"tail_us":1},"status":"keep","description":"Fix flaky tests (min per-shard cap=8 for small caches) + bump freq on occupied inserts. Hit rate 84.9→85.2%, all tests pass 20/20","timestamp":1774644905561,"segment":1,"confidence":3.3732014851303167,"iterationTokens":9372,"asi":{"hypothesis":"Two changes: (1) auto-reduce shard count for small caches so shard_cap >= 8 (fixes birthday-paradox eviction in tests), (2) bump_freq on occupied inserts so writes count as accesses for eviction decisions","result":"hit rate 84.9→85.2% confirmed across 2 sessions. All tests pass 20/20 runs (was flaky before). Tight benchmark clustering [24.6, 24.6, 24.8M].","insight":"the 0.3% hit rate improvement comes from treating writes as accesses — frequently-written keys survive eviction better. The shard fix is pure correctness.","key_wins":"hit rate +0.3%, flaky test fix, robust measurements"}}
{"run":22,"commit":"fd0f37b","metric":24925123,"metrics":{"ops_sec":29347154,"hit_pct":84.9,"p50_us":0.12,"p99_us":1.08,"cv_pct":7.6,"tail_us":0.96},"status":"discard","description":"S3-FIFO paper: reset freq→0 on second chance (was decrement by 1). eff_ops +1.2%, CV -40%, but hit rate 85.2→84.9% (regression)","timestamp":1774645009841,"segment":1,"confidence":3.1997907749173997,"iterationTokens":4183,"asi":{"hypothesis":"S3-FIFO paper resets freq to 0 on second chance instead of decrementing. Faster eviction, more predictable.","rollback_reason":"hit rate dropped 85.2→84.9%. User requires higher hit rate. The faster eviction evicts entries that would have survived with freq-decrement.","next_action_hint":"keep the gradual freq decrement — it gives entries more chances which helps hit rate. The bump_freq on occupied writes is the better hit rate optimization.","insight":"freq reset vs decrement: reset gives better throughput (+1.2%), latency (-3.6% p99), and remarkable consistency [24.9, 24.9, 25.0M] but costs 0.3% hit rate. Tight tradeoff.","notable":"3 runs within 0.2% of each other — most consistent measurement ever"}}
{"run":23,"commit":"b187f97","metric":25202266,"metrics":{"ops_sec":29588054,"hit_pct":85.2,"p50_us":0.12,"p99_us":1.21,"cv_pct":9,"tail_us":1.08},"status":"keep","description":"Increase MAX_FREQ 3→7: more eviction resistance. eff_ops 24.6→25.2M (+2.4%), hit rate 85.2% maintained, p99=1.21µs","timestamp":1774645061035,"segment":1,"confidence":3.4480059035205546,"iterationTokens":2577,"asi":{"hypothesis":"MAX_FREQ 7 gives entries more second chances in main queue, improving eviction quality and hit rate retention.","result":"eff_ops 25.2M (new best), hit_rate 85.2% maintained, benchmark runs [25.6, 25.2, 24.8M]","insight":"higher MAX_FREQ means hot entries accumulate more freq over time and survive more eviction passes. With bump_freq on writes too, frequently-written keys get better protection. The throughput gain comes from fewer actual evictions (more second chances = more entries stay in cache).","key_wins":"new eff_ops best at 25.2M while maintaining 85.2% hit rate"}}
{"run":24,"commit":"b187f97","metric":24607285,"metrics":{"ops_sec":28888439,"hit_pct":85.2,"p50_us":0.12,"p99_us":1.12,"cv_pct":2.8,"tail_us":1},"status":"discard","description":"MAX_FREQ 15: too many second chances, eviction gets expensive. eff_ops 25.2→24.6M (-2.4%)","timestamp":1774645109244,"segment":1,"confidence":3.6547560142832913,"iterationTokens":1741,"asi":{"hypothesis":"MAX_FREQ=15 gives even more eviction resistance","rollback_reason":"eff_ops dropped 2.4%. Too many second chances means evict_from_main does 15 re-enqueues per cold entry, making eviction O(15) per slot instead of O(7)","next_action_hint":"MAX_FREQ=7 is the sweet spot. Don't go higher. Try MAX_FREQ=5 to see if lower is better.","insight":"eviction cost = MAX_FREQ * (pop_front + find + push_back) per cold entry in main. At 15 this dominates insert latency."}}
{"run":25,"commit":"b187f97","metric":23861297,"metrics":{"ops_sec":28013749,"hit_pct":85.2,"p50_us":0.12,"p99_us":0.96,"cv_pct":9.6,"tail_us":0.83},"status":"discard","description":"MAX_FREQ=5: huge variance [21.5M, 25.6M, 23.9M], eff_ops -5.3%. MAX_FREQ=7 confirmed optimal","timestamp":1774645171228,"segment":1,"confidence":4.003386775977958,"iterationTokens":2349,"asi":{"hypothesis":"MAX_FREQ=5 might be a better balance between eviction cost and retention","rollback_reason":"massive variance across 3 runs (21.5-25.6M). eff_ops median 23.9M vs 25.2M at MAX_FREQ=7.","next_action_hint":"MAX_FREQ sweep complete: 3=bad, 5=unstable, 7=optimal, 15=too expensive. Keep 7.","insight":"MAX_FREQ=5 gives fewer second chances, making eviction patterns more sensitive to key ordering within each iteration"}}
